number,value,datetime_start,datetime_complete,duration,params_alpha,params_fit_intercept,params_max_iter,params_selection,params_tol,state
0,0.9242726389254342,2025-06-21 22:32:28.428177,2025-06-21 22:32:28.474175,0 days 00:00:00.045998,0.43733434032348006,False,5000,random,0.0007618690808009665,COMPLETE
1,0.6664987293926028,2025-06-21 22:32:28.474175,2025-06-21 22:32:28.535693,0 days 00:00:00.061518,0.002817936375026706,True,8000,cyclic,0.003958210293622329,COMPLETE
2,0.8571170873285456,2025-06-21 22:32:28.535693,2025-06-21 22:32:28.583692,0 days 00:00:00.047999,0.023186377669802485,False,8000,cyclic,3.472388882479594e-05,COMPLETE
3,0.7728280792795448,2025-06-21 22:32:28.584692,2025-06-21 22:32:28.634209,0 days 00:00:00.049517,0.011740698703606986,True,1000,random,0.006150064470836368,COMPLETE
4,0.8161716486528903,2025-06-21 22:32:28.635211,2025-06-21 22:32:28.698209,0 days 00:00:00.062998,0.01683927068177527,True,6000,random,0.00023692305063496968,COMPLETE
5,0.7740133702606048,2025-06-21 22:32:28.700209,2025-06-21 22:32:28.778730,0 days 00:00:00.078521,0.00640082286273589,False,3000,cyclic,6.23480383290894e-05,COMPLETE
6,0.9367645606010528,2025-06-21 22:32:28.779733,2025-06-21 22:32:28.835254,0 days 00:00:00.055521,0.5153962048538107,False,8000,cyclic,2.3980383985526007e-05,COMPLETE
7,0.7404052153873633,2025-06-21 22:32:28.836258,2025-06-21 22:32:28.879255,0 days 00:00:00.042997,0.008517341423495712,True,6000,cyclic,3.360160762325558e-05,COMPLETE
8,0.8654819166093571,2025-06-21 22:32:28.880255,2025-06-21 22:32:28.926768,0 days 00:00:00.046513,0.0334819583811256,False,7000,cyclic,1.702743251569082e-05,COMPLETE
9,0.739707688614273,2025-06-21 22:32:28.926768,2025-06-21 22:32:28.969766,0 days 00:00:00.042998,0.00180312379066405,False,7000,random,5.825013443645995e-05,COMPLETE
10,0.6412854181034482,2025-06-21 22:32:28.969766,2025-06-21 22:32:29.025280,0 days 00:00:00.055514,0.0002668306864055296,True,10000,cyclic,0.007816566139676812,COMPLETE
11,0.6408026898255462,2025-06-21 22:32:29.025280,2025-06-21 22:32:29.074280,0 days 00:00:00.049000,0.00020807312142236912,True,10000,cyclic,0.009263139180998971,COMPLETE
12,0.6411631133987187,2025-06-21 22:32:29.075283,2025-06-21 22:32:29.123791,0 days 00:00:00.048508,0.000243393608289694,True,10000,cyclic,0.0020721696278383213,COMPLETE
13,0.6397659669275881,2025-06-21 22:32:29.124790,2025-06-21 22:32:29.171796,0 days 00:00:00.047006,0.00010522771248916546,True,10000,cyclic,0.0013556199016735524,COMPLETE
14,0.6403857856517088,2025-06-21 22:32:29.171796,2025-06-21 22:32:29.216814,0 days 00:00:00.045018,0.00016081691145218002,True,9000,cyclic,0.001022070562309994,COMPLETE
15,0.6476223110491492,2025-06-21 22:32:29.217805,2025-06-21 22:32:29.267315,0 days 00:00:00.049510,0.00086362965292252,True,10000,cyclic,0.0009143894766633382,COMPLETE
16,0.639842833351907,2025-06-21 22:32:29.268315,2025-06-21 22:32:29.318320,0 days 00:00:00.050005,0.00010974685905789126,True,9000,cyclic,0.00025750160067550916,COMPLETE
17,0.6460619032956608,2025-06-21 22:32:29.319320,2025-06-21 22:32:29.371842,0 days 00:00:00.052522,0.0006985656428679973,True,3000,cyclic,0.0002271322743514816,COMPLETE
18,0.6399004082429474,2025-06-21 22:32:29.372842,2025-06-21 22:32:29.425355,0 days 00:00:00.052513,0.0001218988385291148,True,9000,random,0.0004086464893437176,COMPLETE
19,0.8588990827188888,2025-06-21 22:32:29.426362,2025-06-21 22:32:29.470356,0 days 00:00:00.043994,0.08289907040939676,True,5000,cyclic,0.00012427178634400954,COMPLETE
20,0.6451730360596324,2025-06-21 22:32:29.471357,2025-06-21 22:32:29.537888,0 days 00:00:00.066531,0.0006013619540202894,True,9000,cyclic,0.0022622308438257055,COMPLETE
21,0.6399314060051171,2025-06-21 22:32:29.538881,2025-06-21 22:32:29.597878,0 days 00:00:00.058997,0.00011217903227289556,True,9000,random,0.00047444856024054323,COMPLETE
22,0.6430740525100874,2025-06-21 22:32:29.597878,2025-06-21 22:32:29.650389,0 days 00:00:00.052511,0.00040569566898370396,True,9000,random,0.0004394991638118249,COMPLETE
23,0.6398983697482192,2025-06-21 22:32:29.651389,2025-06-21 22:32:29.711391,0 days 00:00:00.060002,0.00011288461579381963,True,7000,random,0.00014930608508589792,COMPLETE
24,0.6554886051284787,2025-06-21 22:32:29.711391,2025-06-21 22:32:29.764902,0 days 00:00:00.053511,0.0016198306895361615,True,8000,random,0.00013281177507916086,COMPLETE
25,0.6397940754118516,2025-06-21 22:32:29.765902,2025-06-21 22:32:29.823416,0 days 00:00:00.057514,0.00010372935263256812,True,7000,random,0.00011400527633806634,COMPLETE
26,0.6430194064620511,2025-06-21 22:32:29.824417,2025-06-21 22:32:29.872425,0 days 00:00:00.048008,0.0004015279808560232,True,7000,random,7.803753327614296e-05,COMPLETE
27,0.6746478296163666,2025-06-21 22:32:29.873417,2025-06-21 22:32:29.924852,0 days 00:00:00.051435,0.003543268006686178,True,4000,cyclic,0.0017488898798757513,COMPLETE
28,0.6506275095734299,2025-06-21 22:32:29.925857,2025-06-21 22:32:29.981853,0 days 00:00:00.055996,0.001135162765248161,True,8000,random,0.0006712835634873036,COMPLETE
29,0.8718926382921925,2025-06-21 22:32:29.981853,2025-06-21 22:32:30.030361,0 days 00:00:00.048508,0.08021749519711348,False,6000,random,0.00026493116414442596,COMPLETE
30,1.0001595451603345,2025-06-21 22:32:30.031361,2025-06-21 22:32:30.080366,0 days 00:00:00.049005,0.9064270214422925,True,10000,cyclic,0.0012327081369242641,COMPLETE
31,0.6400975447328815,2025-06-21 22:32:30.081363,2025-06-21 22:32:30.141085,0 days 00:00:00.059722,0.000134500029552025,True,7000,random,0.0001460536449726775,COMPLETE
32,0.6427252019643991,2025-06-21 22:32:30.142086,2025-06-21 22:32:30.204686,0 days 00:00:00.062600,0.00038019618939790954,True,5000,random,8.864110730032678e-05,COMPLETE
33,0.6398704250286673,2025-06-21 22:32:30.205686,2025-06-21 22:32:30.257768,0 days 00:00:00.052082,0.00010720016511094315,True,8000,random,1.0700306946996299e-05,COMPLETE
34,0.6407407555601448,2025-06-21 22:32:30.258768,2025-06-21 22:32:30.307771,0 days 00:00:00.049003,0.00021384967794549098,True,8000,random,0.0035902873087866522,COMPLETE
35,0.642842804666103,2025-06-21 22:32:30.307771,2025-06-21 22:32:30.364308,0 days 00:00:00.056537,0.00038792143438239545,True,9000,random,1.0470220961013322e-05,COMPLETE
36,0.7274802665854982,2025-06-21 22:32:30.364308,2025-06-21 22:32:30.422828,0 days 00:00:00.058520,0.00010507381328335906,False,8000,random,4.318585986783731e-05,COMPLETE
37,0.6413348665750563,2025-06-21 22:32:30.423832,2025-06-21 22:32:30.472828,0 days 00:00:00.048996,0.0002509823488961058,True,1000,cyclic,0.0006498091248461375,COMPLETE
38,0.6447237860649625,2025-06-21 22:32:30.473839,2025-06-21 22:32:30.524302,0 days 00:00:00.050463,0.0005262798495007545,True,6000,cyclic,1.6120292387335106e-05,COMPLETE
39,0.7587102827401749,2025-06-21 22:32:30.524302,2025-06-21 22:32:30.571302,0 days 00:00:00.047000,0.004438581323611426,False,9000,random,0.004198168769130015,COMPLETE
40,0.6508408573870686,2025-06-21 22:32:30.572302,2025-06-21 22:32:30.626815,0 days 00:00:00.054513,0.0011579038128769537,True,7000,cyclic,0.00020217592762787135,COMPLETE
41,0.6404383477372348,2025-06-21 22:32:30.627815,2025-06-21 22:32:30.678817,0 days 00:00:00.051002,0.00016519748175106025,True,7000,random,0.00034192938546501026,COMPLETE
42,0.6397674192535984,2025-06-21 22:32:30.679814,2025-06-21 22:32:30.740345,0 days 00:00:00.060531,0.00010277124830227715,True,8000,random,0.0001713821451765716,COMPLETE
43,0.6418713562322254,2025-06-21 22:32:30.741347,2025-06-21 22:32:30.799350,0 days 00:00:00.058003,0.00030978966075356166,True,8000,random,3.0079259853028795e-05,COMPLETE
44,0.6405841957319751,2025-06-21 22:32:30.799350,2025-06-21 22:32:30.848875,0 days 00:00:00.049525,0.00018675632817029324,True,10000,random,5.558215807119998e-05,COMPLETE
45,0.7279560034883842,2025-06-21 22:32:30.849874,2025-06-21 22:32:30.898885,0 days 00:00:00.049011,0.00017275926267783326,False,8000,random,0.00011063814698663843,COMPLETE
46,0.639809914170335,2025-06-21 22:32:30.899877,2025-06-21 22:32:30.946980,0 days 00:00:00.047103,0.00010495329173105737,True,8000,cyclic,0.00019385698400426572,COMPLETE
47,0.6414478167394584,2025-06-21 22:32:30.947980,2025-06-21 22:32:31.000978,0 days 00:00:00.052998,0.00025630249578569307,True,10000,cyclic,0.00018517712811987982,COMPLETE
48,0.8556623474654966,2025-06-21 22:32:31.001982,2025-06-21 22:32:31.055506,0 days 00:00:00.053524,0.028513365655216772,True,9000,cyclic,8.713415532163631e-05,COMPLETE
49,0.7895385333260184,2025-06-21 22:32:31.055506,2025-06-21 22:32:31.112510,0 days 00:00:00.057004,0.013719911701555256,True,6000,cyclic,0.00026636647882529856,COMPLETE
50,0.7279344291903732,2025-06-21 22:32:31.113511,2025-06-21 22:32:31.164017,0 days 00:00:00.050506,0.0001674687385477549,False,9000,cyclic,0.0005510645238645635,COMPLETE
51,0.6398289251236828,2025-06-21 22:32:31.164017,2025-06-21 22:32:31.223531,0 days 00:00:00.059514,0.00010652124046632496,True,8000,cyclic,0.00031634624338439603,COMPLETE
52,0.639753005765468,2025-06-21 22:32:31.224531,2025-06-21 22:32:31.278531,0 days 00:00:00.054000,0.0001002442348811858,True,7000,cyclic,0.0003373650424842769,COMPLETE
53,0.639753005765468,2025-06-21 22:32:31.279532,2025-06-21 22:32:31.337050,0 days 00:00:00.057518,0.0001000775107217426,True,7000,cyclic,0.00017226451697589112,COMPLETE
54,0.6404433080874172,2025-06-21 22:32:31.337050,2025-06-21 22:32:31.386051,0 days 00:00:00.049001,0.00016360413952306056,True,6000,cyclic,0.00018449111881077616,COMPLETE
55,0.6410610427401526,2025-06-21 22:32:31.387053,2025-06-21 22:32:31.438202,0 days 00:00:00.051149,0.00024092013158897286,True,7000,cyclic,0.00010365823089548129,COMPLETE
56,0.6448394356744725,2025-06-21 22:32:31.438202,2025-06-21 22:32:31.493202,0 days 00:00:00.055000,0.0005293466005600201,True,5000,cyclic,5.7231682833053116e-05,COMPLETE
57,0.641667602903997,2025-06-21 22:32:31.494209,2025-06-21 22:32:31.548720,0 days 00:00:00.054511,0.00029289355664602226,True,2000,cyclic,0.0003471036307612928,COMPLETE
58,0.6403322365587893,2025-06-21 22:32:31.549720,2025-06-21 22:32:31.597725,0 days 00:00:00.048005,0.00015129883416889386,True,7000,cyclic,0.00015563289584695614,COMPLETE
59,0.6477405557787556,2025-06-21 22:32:31.597725,2025-06-21 22:32:31.650256,0 days 00:00:00.052531,0.0008861466715904283,True,4000,cyclic,6.551686430760104e-05,COMPLETE
60,0.8586841065537977,2025-06-21 22:32:31.651247,2025-06-21 22:32:31.703245,0 days 00:00:00.051998,0.07412154695540944,True,6000,cyclic,0.0008494593705338553,COMPLETE
61,0.6397940754118516,2025-06-21 22:32:31.703245,2025-06-21 22:32:31.753769,0 days 00:00:00.050524,0.0001036557083323595,True,8000,cyclic,0.00030701557854451747,COMPLETE
62,0.6402418526514668,2025-06-21 22:32:31.753769,2025-06-21 22:32:31.805755,0 days 00:00:00.051986,0.0001420437252555216,True,7000,cyclic,0.00023116144715347627,COMPLETE
63,0.6408192174618643,2025-06-21 22:32:31.805755,2025-06-21 22:32:31.863271,0 days 00:00:00.057516,0.0002089717295415486,True,8000,cyclic,0.00016942367498024548,COMPLETE
64,0.6397386207065561,2025-06-21 22:32:31.863271,2025-06-21 22:32:31.919273,0 days 00:00:00.056002,0.0001001956714330879,True,7000,cyclic,0.0012771839858400772,COMPLETE
65,0.8622787100393949,2025-06-21 22:32:31.920273,2025-06-21 22:32:31.979781,0 days 00:00:00.059508,0.15260972513542165,True,6000,cyclic,0.0011717330943042577,COMPLETE
66,0.640112422345159,2025-06-21 22:32:31.980784,2025-06-21 22:32:32.033311,0 days 00:00:00.052527,0.00013831762667777624,True,7000,cyclic,0.0013177198325791254,COMPLETE
67,0.6423456954997382,2025-06-21 22:32:32.033311,2025-06-21 22:32:32.087319,0 days 00:00:00.054008,0.00035893419315701213,True,7000,cyclic,0.002688863976422689,COMPLETE
68,0.6397386207065561,2025-06-21 22:32:32.088316,2025-06-21 22:32:32.138825,0 days 00:00:00.050509,0.00010137755030791396,True,6000,cyclic,0.0017449562880375408,COMPLETE
69,0.7280479822668937,2025-06-21 22:32:32.139825,2025-06-21 22:32:32.183834,0 days 00:00:00.044009,0.00019614916307645448,False,6000,cyclic,0.0016389573718954239,COMPLETE
70,0.6445681756679167,2025-06-21 22:32:32.184834,2025-06-21 22:32:32.231335,0 days 00:00:00.046501,0.0005225837854417069,True,4000,cyclic,0.00601217303475706,COMPLETE
71,0.6397386207065561,2025-06-21 22:32:32.232338,2025-06-21 22:32:32.291334,0 days 00:00:00.058996,0.00010062688314024889,True,7000,cyclic,0.002802598458244838,COMPLETE
72,0.6400519979614064,2025-06-21 22:32:32.291334,2025-06-21 22:32:32.354711,0 days 00:00:00.063377,0.00013644926898702771,True,7000,cyclic,0.0032085035917527914,COMPLETE
73,0.6417196734176411,2025-06-21 22:32:32.355711,2025-06-21 22:32:32.414291,0 days 00:00:00.058580,0.0002999938249007042,True,6000,cyclic,0.004648713398602458,COMPLETE
74,0.6397386207065561,2025-06-21 22:32:32.414291,2025-06-21 22:32:32.460356,0 days 00:00:00.046065,0.00010029604841305326,True,7000,cyclic,0.0018890552537482322,COMPLETE
75,0.6407723961703254,2025-06-21 22:32:32.461355,2025-06-21 22:32:32.514383,0 days 00:00:00.053028,0.00021137059278660477,True,6000,cyclic,0.002197254259625435,COMPLETE
76,0.6399306741309142,2025-06-21 22:32:32.515383,2025-06-21 22:32:32.568881,0 days 00:00:00.053498,0.00012542925663670845,True,7000,cyclic,0.0015421082755547508,COMPLETE
77,0.7225166890452975,2025-06-21 22:32:32.569881,2025-06-21 22:32:32.624390,0 days 00:00:00.054509,0.007130244866954148,True,7000,cyclic,0.0026861340726544243,COMPLETE
78,0.6401729530498296,2025-06-21 22:32:32.625390,2025-06-21 22:32:32.675392,0 days 00:00:00.050002,0.00014066983501069007,True,5000,cyclic,0.000958014110386054,COMPLETE
79,0.6407750483006565,2025-06-21 22:32:32.676392,2025-06-21 22:32:32.727901,0 days 00:00:00.051509,0.00020397516478526327,True,6000,cyclic,0.0019514051620435346,COMPLETE
80,0.6397386207065561,2025-06-21 22:32:32.728914,2025-06-21 22:32:32.781900,0 days 00:00:00.052986,0.00010050180078539033,True,5000,cyclic,0.00511464445010612,COMPLETE
81,0.6397152877501187,2025-06-21 22:32:32.782900,2025-06-21 22:32:32.840415,0 days 00:00:00.057515,0.00010009409632312433,True,5000,cyclic,0.005903783163770332,COMPLETE
82,0.6398817472915185,2025-06-21 22:32:32.841414,2025-06-21 22:32:32.895415,0 days 00:00:00.054001,0.00012712337735812582,True,5000,cyclic,0.007869058849919433,COMPLETE
83,0.6404025562195534,2025-06-21 22:32:32.896416,2025-06-21 22:32:32.944960,0 days 00:00:00.048544,0.00016485889064813322,True,4000,cyclic,0.005850796743599219,COMPLETE
84,0.6623164772356397,2025-06-21 22:32:32.944960,2025-06-21 22:32:32.995941,0 days 00:00:00.050981,0.00236132778184878,True,5000,cyclic,0.004835935654334555,COMPLETE
85,0.6415632149269774,2025-06-21 22:32:32.996942,2025-06-21 22:32:33.047459,0 days 00:00:00.050517,0.0002650540512283005,True,3000,cyclic,0.003322465551990256,COMPLETE
86,0.7274852816816136,2025-06-21 22:32:33.047459,2025-06-21 22:32:33.097456,0 days 00:00:00.049997,0.00010009887986461411,False,5000,cyclic,0.002622586013975701,COMPLETE
87,0.6400060295678025,2025-06-21 22:32:33.097456,2025-06-21 22:32:33.148966,0 days 00:00:00.051510,0.0001300186523878691,True,4000,cyclic,0.0014151987303733004,COMPLETE
88,0.6420761508804297,2025-06-21 22:32:33.149967,2025-06-21 22:32:33.202967,0 days 00:00:00.053000,0.00033973839826441365,True,5000,cyclic,0.0076572581618296305,COMPLETE
89,0.6405078029567431,2025-06-21 22:32:33.203967,2025-06-21 22:32:33.255483,0 days 00:00:00.051516,0.00018155473767952118,True,5000,cyclic,0.009508779505614568,COMPLETE
90,0.643535099799328,2025-06-21 22:32:33.255483,2025-06-21 22:32:33.311480,0 days 00:00:00.055997,0.0004378005043347072,True,6000,cyclic,0.0018219097753096253,COMPLETE
91,0.6397489832733467,2025-06-21 22:32:33.312480,2025-06-21 22:32:33.370988,0 days 00:00:00.058508,0.00010313002141044332,True,7000,cyclic,0.0010716249671733824,COMPLETE
92,0.6399413457338846,2025-06-21 22:32:33.370988,2025-06-21 22:32:33.421998,0 days 00:00:00.051010,0.00012392380539815327,True,7000,cyclic,0.0011786342390119997,COMPLETE
93,0.6409793059609757,2025-06-21 22:32:33.422997,2025-06-21 22:32:33.471527,0 days 00:00:00.048530,0.00023911026031269732,True,6000,cyclic,0.0006817166867147855,COMPLETE
94,0.6403649664322217,2025-06-21 22:32:33.471527,2025-06-21 22:32:33.529045,0 days 00:00:00.057518,0.00016170478534101814,True,7000,cyclic,0.003778253496240654,COMPLETE
95,0.639753005765468,2025-06-21 22:32:33.529045,2025-06-21 22:32:33.592044,0 days 00:00:00.062999,0.00010132825662873214,True,7000,cyclic,0.0007976783075698016,COMPLETE
96,0.6399128050078651,2025-06-21 22:32:33.592044,2025-06-21 22:32:33.656559,0 days 00:00:00.064515,0.00012317874409594813,True,7000,cyclic,0.0007944325895695845,COMPLETE
97,0.6397386207065561,2025-06-21 22:32:33.657559,2025-06-21 22:32:33.720563,0 days 00:00:00.063004,0.00010083479064494054,True,6000,cyclic,0.0010461514041230006,COMPLETE
98,0.6406202252888654,2025-06-21 22:32:33.720563,2025-06-21 22:32:33.776076,0 days 00:00:00.055513,0.0001882959750513435,True,6000,cyclic,0.0010292867132876333,COMPLETE
99,0.727876305384771,2025-06-21 22:32:33.777076,2025-06-21 22:32:33.826612,0 days 00:00:00.049536,0.00015382655305770358,False,6000,cyclic,0.0005135478426414911,COMPLETE
100,0.6410619360595932,2025-06-21 22:32:33.826612,2025-06-21 22:32:33.884611,0 days 00:00:00.057999,0.0002402524254563901,True,7000,cyclic,0.0023727786852791,COMPLETE
101,0.6398127272241526,2025-06-21 22:32:33.885611,2025-06-21 22:32:33.944132,0 days 00:00:00.058521,0.00011831493658892952,True,7000,cyclic,0.0031025083396123187,COMPLETE
102,0.6397386207065561,2025-06-21 22:32:33.944132,2025-06-21 22:32:33.995128,0 days 00:00:00.050996,0.00010071013866005661,True,7000,cyclic,0.0009867823860497673,COMPLETE
103,0.6402894217768231,2025-06-21 22:32:33.996128,2025-06-21 22:32:34.047637,0 days 00:00:00.051509,0.00014526843103650314,True,7000,cyclic,0.0010633010370643726,COMPLETE
104,0.6404827109637032,2025-06-21 22:32:34.048637,2025-06-21 22:32:34.104640,0 days 00:00:00.056003,0.00017562903081209963,True,6000,cyclic,0.0015221915210090738,COMPLETE
105,0.6400199218442923,2025-06-21 22:32:34.105639,2025-06-21 22:32:34.160153,0 days 00:00:00.054514,0.00013139266917638518,True,8000,cyclic,0.0004120745845538908,COMPLETE
106,0.640777932130925,2025-06-21 22:32:34.161153,2025-06-21 22:32:34.214160,0 days 00:00:00.053007,0.0002107402322062708,True,6000,cyclic,0.0051019444097604155,COMPLETE
107,0.639819773936302,2025-06-21 22:32:34.214160,2025-06-21 22:32:34.267683,0 days 00:00:00.053523,0.00011479312311037013,True,7000,cyclic,0.000573547704532295,COMPLETE
108,0.6403110646100203,2025-06-21 22:32:34.267683,2025-06-21 22:32:34.320688,0 days 00:00:00.053005,0.00014911208562424147,True,5000,cyclic,0.004307563188214271,COMPLETE
109,0.641671615493563,2025-06-21 22:32:34.320688,2025-06-21 22:32:34.375199,0 days 00:00:00.054511,0.0002986505061982452,True,8000,cyclic,0.006846886289974543,COMPLETE
110,0.6397489832733467,2025-06-21 22:32:34.376199,2025-06-21 22:32:34.431717,0 days 00:00:00.055518,0.00010307906837190516,True,7000,cyclic,0.0019339584938337393,COMPLETE
111,0.6398537543179434,2025-06-21 22:32:34.431717,2025-06-21 22:32:34.491716,0 days 00:00:00.059999,0.00012034878094721219,True,7000,cyclic,0.0018528864815200862,COMPLETE
112,0.6397386207065561,2025-06-21 22:32:34.491716,2025-06-21 22:32:34.549732,0 days 00:00:00.058016,0.00010114565646129279,True,7000,cyclic,0.0020669178540689698,COMPLETE
113,0.640458589397514,2025-06-21 22:32:34.550806,2025-06-21 22:32:34.604405,0 days 00:00:00.053599,0.0001730210400016668,True,6000,cyclic,0.0022234456044793603,COMPLETE
114,0.6397659669275881,2025-06-21 22:32:34.605410,2025-06-21 22:32:34.655941,0 days 00:00:00.050531,0.00010397272718320163,True,7000,cyclic,0.0012928599813410268,COMPLETE
115,0.6403465392361839,2025-06-21 22:32:34.655941,2025-06-21 22:32:34.707482,0 days 00:00:00.051541,0.0001504523650507031,True,7000,cyclic,0.0016931929531405197,COMPLETE
116,0.6397386207065561,2025-06-21 22:32:34.707482,2025-06-21 22:32:34.761001,0 days 00:00:00.053519,0.0001009432901592987,True,6000,cyclic,0.0028960206844340984,COMPLETE
117,0.6407571600388734,2025-06-21 22:32:34.762001,2025-06-21 22:32:34.817008,0 days 00:00:00.055007,0.00020577678715004067,True,6000,cyclic,0.0028298802155918247,COMPLETE
118,0.8695818781313391,2025-06-21 22:32:34.817008,2025-06-21 22:32:34.863527,0 days 00:00:00.046519,0.25098231323521647,True,6000,cyclic,0.0024033862286852252,COMPLETE
119,0.7276505801099831,2025-06-21 22:32:34.864527,2025-06-21 22:32:34.916534,0 days 00:00:00.052007,0.0001243545914940302,False,6000,cyclic,0.003755081337183524,COMPLETE
120,0.8310428006067717,2025-06-21 22:32:34.917534,2025-06-21 22:32:34.970044,0 days 00:00:00.052510,0.019605646388018472,True,5000,cyclic,0.0020430637754308843,COMPLETE
121,0.6397386207065561,2025-06-21 22:32:34.971044,2025-06-21 22:32:35.022066,0 days 00:00:00.051022,0.0001020586318001003,True,7000,cyclic,0.0014407784252887536,COMPLETE
122,0.6400519979614064,2025-06-21 22:32:35.023582,2025-06-21 22:32:35.077591,0 days 00:00:00.054009,0.00013574006826103617,True,8000,cyclic,0.0011094555436309491,COMPLETE
123,0.8572444592561586,2025-06-21 22:32:35.078593,2025-06-21 22:32:35.134898,0 days 00:00:00.056305,0.04490013131475199,True,7000,cyclic,0.0014491682035159062,COMPLETE
124,0.6404632196690718,2025-06-21 22:32:35.134898,2025-06-21 22:32:35.183900,0 days 00:00:00.049002,0.00017269243720519428,True,7000,cyclic,0.0008700947836936397,COMPLETE
125,0.6397509806402063,2025-06-21 22:32:35.183900,2025-06-21 22:32:35.241425,0 days 00:00:00.057525,0.0001026724406167819,True,7000,cyclic,0.0016714662488497422,COMPLETE
126,0.6397386207065561,2025-06-21 22:32:35.242428,2025-06-21 22:32:35.300425,0 days 00:00:00.057997,0.00010017777036143381,True,5000,cyclic,0.002016121274983578,COMPLETE
127,0.6403161099755571,2025-06-21 22:32:35.300425,2025-06-21 22:32:35.354957,0 days 00:00:00.054532,0.0001475736222097125,True,5000,cyclic,0.005307707713262556,COMPLETE
