number,value,datetime_start,datetime_complete,duration,params_alpha,params_fit_intercept,params_max_iter,params_selection,params_tol,state
128,0.63988299133173,2025-06-21 22:32:35.354957,2025-06-21 22:32:35.410960,0 days 00:00:00.056003,0.00012086200183725917,True,4000,cyclic,0.001238960182216056,COMPLETE
129,0.640981476165194,2025-06-21 22:32:35.411963,2025-06-21 22:32:35.467474,0 days 00:00:00.055511,0.00023113170724199374,True,5000,cyclic,0.003458448721753391,COMPLETE
130,0.6405011491493249,2025-06-21 22:32:35.467474,2025-06-21 22:32:35.522481,0 days 00:00:00.055007,0.00017696542152797852,True,5000,cyclic,0.0029415323949385894,COMPLETE
131,0.6399988310772454,2025-06-21 22:32:35.522481,2025-06-21 22:32:35.580991,0 days 00:00:00.058510,0.00012786742546061123,True,6000,cyclic,0.0020391772989995995,COMPLETE
132,0.6397386207065561,2025-06-21 22:32:35.581992,2025-06-21 22:32:35.634506,0 days 00:00:00.052514,0.00010178348599967068,True,7000,cyclic,0.0018047502398381447,COMPLETE
133,0.6403110646100203,2025-06-21 22:32:35.635505,2025-06-21 22:32:35.682507,0 days 00:00:00.047002,0.00014862001961796263,True,6000,cyclic,0.0014505992705627704,COMPLETE
134,0.6397386207065561,2025-06-21 22:32:35.682507,2025-06-21 22:32:35.733052,0 days 00:00:00.050545,0.00010124379561921247,True,5000,cyclic,0.0024252397293283885,COMPLETE
135,0.6397386207065561,2025-06-21 22:32:35.734054,2025-06-21 22:32:35.785053,0 days 00:00:00.050999,0.0001011564041974521,True,5000,cyclic,0.0024467317578350167,COMPLETE
136,0.6399306741309142,2025-06-21 22:32:35.785053,2025-06-21 22:32:35.834613,0 days 00:00:00.049560,0.00012519581812225856,True,4000,cyclic,0.002210456875772497,COMPLETE
137,0.6407541544055093,2025-06-21 22:32:35.835608,2025-06-21 22:32:35.890600,0 days 00:00:00.054992,0.00019250517987099097,True,5000,cyclic,0.0016704294973001372,COMPLETE
138,0.6403110646100203,2025-06-21 22:32:35.891601,2025-06-21 22:32:35.965126,0 days 00:00:00.073525,0.00014977753094653598,True,5000,cyclic,0.0026359774966300347,COMPLETE
139,0.7657385090955822,2025-06-21 22:32:35.966126,2025-06-21 22:32:36.040640,0 days 00:00:00.074514,0.011074460312805552,True,6000,cyclic,0.004240356580527747,COMPLETE
140,0.7276407201352271,2025-06-21 22:32:36.041640,2025-06-21 22:32:36.092643,0 days 00:00:00.051003,0.00011968550504679265,False,5000,cyclic,0.0031674556730010807,COMPLETE
141,0.6397489832733467,2025-06-21 22:32:36.092643,2025-06-21 22:32:36.140162,0 days 00:00:00.047519,0.00010323664354060698,True,5000,cyclic,0.0024707603435863957,COMPLETE
142,0.63988299133173,2025-06-21 22:32:36.141161,2025-06-21 22:32:36.192161,0 days 00:00:00.051000,0.00012091972769958505,True,5000,cyclic,0.002000834362243048,COMPLETE
143,0.6899503090403094,2025-06-21 22:32:36.193161,2025-06-21 22:32:36.251671,0 days 00:00:00.058510,0.004790718208131124,True,5000,cyclic,0.0017908047676181676,COMPLETE
144,0.6402894217768231,2025-06-21 22:32:36.252671,2025-06-21 22:32:36.300673,0 days 00:00:00.048002,0.00014536209765700817,True,4000,cyclic,0.0014531521309902311,COMPLETE
145,0.6397386207065561,2025-06-21 22:32:36.301673,2025-06-21 22:32:36.354187,0 days 00:00:00.052514,0.00010140772791514653,True,5000,cyclic,0.0023933088875160153,COMPLETE
146,0.6405195877484455,2025-06-21 22:32:36.355187,2025-06-21 22:32:36.406188,0 days 00:00:00.051001,0.00018150591523961727,True,6000,cyclic,0.0028799881841197472,COMPLETE
147,0.6397035026273526,2025-06-21 22:32:36.407188,2025-06-21 22:32:36.461399,0 days 00:00:00.054211,0.00010005866542113293,True,6000,cyclic,0.006591017341678076,COMPLETE
148,0.6401552170891235,2025-06-21 22:32:36.461399,2025-06-21 22:32:36.516415,0 days 00:00:00.055016,0.000139474276549116,True,6000,cyclic,0.007236078475535477,COMPLETE
149,0.6397867601193047,2025-06-21 22:32:36.517407,2025-06-21 22:32:36.565922,0 days 00:00:00.048515,0.00012066141247796489,True,7000,cyclic,0.005755493480655447,COMPLETE
